{"all_gates_ready":true,"contract_id":"relationship-contract-v1","final_matrix":{"path":"data/contracts/relationships/v1/post-remediation-endpoint-matrix.json","relation_count":21424,"relation_ids_sha256":"34fed6f5677dd91cd2ab3d3533fa827f65b82ed1586c19e82bb9053a4d8cd73b","sha256":"1ab60a2651a1791d84f3194546888864e4ae2ae5daf40b848ef8c9aa6bba1509","tuple_count":1008,"tuple_set_sha256":"8278320f178d7e221aaa0dfedfa28d853bbe2852bbcf438631e9501c1a22005e"},"gate_count":7,"gates":[{"artifact_path":"data/contracts/relationships/v1/enforcement-gates/bus_lane_acquisition_linkage.json","artifact_sha256":"90a35cd029775172644ca908af273dbfafcdf58107815e07ba54a0800f966036","criteria":["The pinned 321-candidate acquisition set is researched, receipted, and exclusively accounted.","All 54 evidence-supported linkage relation identities are live canonical relations with exact endpoints and evidence."],"gate_id":"bus_lane_acquisition_linkage","status":"ready","violation_count":0},{"artifact_path":"data/contracts/relationships/v1/enforcement-gates/determinism_and_consumer_proof.json","artifact_sha256":"a2390bfe8a6319573dbb142cc7175f64f32108d0b48238159d38c9cfb5024865","criteria":["Two clean materializations, SQLite rebuilds, and release exports reproduce byte hashes.","The complete command suite passes while LATEST, rc20, and Tracker state remain immutable."],"gate_id":"determinism_and_consumer_proof","status":"ready","violation_count":0},{"artifact_path":"data/contracts/relationships/v1/enforcement-gates/occurrence_treatment_physicality.json","artifact_sha256":"20a63eb196ac6862ed4ca698d40a664ec4b2af5988f908576227b3c56ac6a150","criteria":["Every eligible occurrence has reviewed phase identity and every physical treatment has supported physical scope."],"gate_id":"occurrence_treatment_physicality","status":"ready","violation_count":0},{"artifact_path":"data/contracts/relationships/v1/enforcement-gates/payload_reference_integrity.json","artifact_sha256":"8667cb0715134021dd6aa4ea2b0c0f9ba2e0c23275fac3e93b0cd9af8a66d8df","criteria":["Every enforceable payload reference resolves uniquely or is covered by an exact reviewed decision."],"gate_id":"payload_reference_integrity","status":"ready","violation_count":0},{"artifact_path":"data/contracts/relationships/v1/enforcement-gates/referential_type_evidence_integrity.json","artifact_sha256":"51778a000ebc286d72d3ac844e0e57ff7c9c53e5a38cda92eeea56031019427b","criteria":["Repository and sealed SQLite diagnostics prove zero endpoint, type, evidence, parity, selector, waiver, and foreign-key violations."],"gate_id":"referential_type_evidence_integrity","status":"ready","violation_count":0},{"artifact_path":"data/contracts/relationships/v1/enforcement-gates/relationship_completeness.json","artifact_sha256":"3e9d359a90aea1f2a2ac9298109b7a5a8ac96e36ea8fdbc79830c35d21dd1910","criteria":["Every versioned completeness selector has zero warnings and its complete denominator is reconciled."],"gate_id":"relationship_completeness","status":"ready","violation_count":0},{"artifact_path":"data/contracts/relationships/v1/enforcement-gates/semantic_remediation.json","artifact_sha256":"3c59c96f2f9f188176b8f7f1e7503383b4db31ad20b4d6f9d998ee8368fff7e5","criteria":["Every reviewed semantic decision is reconciled with zero skipped corrections and zero unmapped relations."],"gate_id":"semantic_remediation","status":"ready","violation_count":0}],"previous_proof":{"path":"data/contracts/relationships/v1/enforcement-proofs/b0c1aa7c99c67b2d4efb39a5fd56777efc570b7c4cc018c4573e5503649fb303/proof.json","proof_stage":"pre_promotion_warning","sha256":"b0c1aa7c99c67b2d4efb39a5fd56777efc570b7c4cc018c4573e5503649fb303"},"proof_id":"relationship-contract-v1-enforcement-proof","proof_stage":"post_promotion_enforced","proof_status":"ready","reviewed_at":"2026-07-21T04:00:00.000Z","reviewed_by":"codex-flatbush-onset-2026-07-21","schema_version":2,"source_refresh_receipt":{"path":"data/contracts/relationships/v1/enforcement-source-refresh-receipts/33a1ab94121970bf3ce09d4e72ed0b312f3a35443b0ac8174d1498f1214e0980.json","sha256":"33a1ab94121970bf3ce09d4e72ed0b312f3a35443b0ac8174d1498f1214e0980"},"total_violation_count":0,"transition_receipt":{"path":"data/contracts/relationships/v1/enforcement-transition-receipts/7480d7da706b5e2080e3ac6ead9b8dc9e5b50d8e418a4105bceb84f0b712a635.json","sha256":"7480d7da706b5e2080e3ac6ead9b8dc9e5b50d8e418a4105bceb84f0b712a635"},"validation_mode":"enforce"}
